{
  "contract_version": "CHGR-001/1.0",
  "created_at": "2026-07-23T00:00:00Z",
  "digest_algorithm": "sha256",
  "extensions": {},
  "limitations": [
    "This is a synthetic fixture."
  ],
  "payload_digest": "fb496f45e361a775d3692b26125f307eadf14e15d0cf35422776aa93f79e43e3",
  "record_digest": "7ecb5b598d9c314b978402ed914ddad45887d983a4b667872cea440b315e6718",
  "record_id": "chgrintg-e1d1495fba14471f8290b3a2bc2acdf8",
  "record_type": "governance_record_integrity",
  "rendering_digest": "fb496f45e361a775d3692b26125f307eadf14e15d0cf35422776aa93f79e43e3",
  "schema_id": "https://pcae.local/schemas/chgr/records/governance_record_integrity.schema.json",
  "schema_version": "1.0"
}
