{
  "contract_version": "CHGR-001/1.0",
  "created_at": "2026-08-20T03:19:24.899126Z",
  "digest_algorithm": "sha256",
  "extensions": {},
  "limitations": [],
  "payload_digest": "1d6db0519cae95712f0cbe3efb12b2461db2ed3d6089b1778f0bbdce2f90dd63",
  "record_digest": "8e88fcb40d6e2ef1236ae065eb3436cfef922ae2395a551f0323b1306a4d479a",
  "record_id": "chgrintg-897b9a61a721486fb1655d37fd46a524",
  "record_type": "governance_record_integrity",
  "rendering_digest": "b0484914c7a76114cd7dae40dad0a4eff512051184a0d106f3e07fef99c4cd8a",
  "schema_id": "https://pcae.local/schemas/chgr/records/governance_record_integrity.schema.json",
  "schema_version": "1.0"
}
