{
  "contract_version": "CHGR-001/1.0",
  "created_at": "2026-08-15T15:31:19.215041Z",
  "digest_algorithm": "sha256",
  "extensions": {},
  "limitations": [],
  "payload_digest": "d2a6354c4389c36de176211b4c38c1563c8b8ea316c9122ba60a98542a424a17",
  "record_digest": "51fd2ec3947386dcf4e9c6506ba60bcf6de533975fd2761479e7dfc335d5c10c",
  "record_id": "chgrintg-274d304d16c34407a7125a632d3d0f14",
  "record_type": "governance_record_integrity",
  "rendering_digest": "31c0f73908dc22c7b26d7b03ca19d0514e447364487f3a2bdbfcd8de4d7125bc",
  "schema_id": "https://pcae.local/schemas/chgr/records/governance_record_integrity.schema.json",
  "schema_version": "1.0"
}
