{
  "contract_version": "CHGR-001/1.0",
  "created_at": "2026-08-15T07:54:39.711312Z",
  "digest_algorithm": "sha256",
  "extensions": {},
  "limitations": [],
  "payload_digest": "1f4971a804fe44894a28e103876da8b0f72be3f226eea86a935257e2df54cca1",
  "record_digest": "9945c5e85d16b57a18fa742b78c1f9cc3ba3d8e352cb7450bc8ea7f29cd2b80a",
  "record_id": "chgrintg-cb6d788751e74d9d99c09b9869b6ad2a",
  "record_type": "governance_record_integrity",
  "rendering_digest": "543baa8ccb7594b99215e22d1fd2b7a9aad116a1e85a42a109bfbbd53ce7165b",
  "schema_id": "https://pcae.local/schemas/chgr/records/governance_record_integrity.schema.json",
  "schema_version": "1.0"
}
