{
  "contract_version": "CHGR-001/1.0",
  "created_at": "2026-07-23T00:00:00Z",
  "digest_algorithm": "sha256",
  "extensions": {},
  "limitations": [
    "This is a synthetic fixture."
  ],
  "payload_digest": "1111111111111111111111111111111111111111111111111111111111111111",
  "record_digest": "802560e508276dad71d0a80673a020192a285b4c6e1cd434ed8e035e4e1e0414",
  "record_id": "chgrintg-8d7fa37748da4a11b46491da0b66a8e2",
  "record_type": "governance_record_integrity",
  "rendering_digest": "ef0c116bc11d95127aac997bee5de7255d88adfa7a08e96df03e360940aed73f",
  "schema_id": "https://pcae.local/schemas/chgr/records/governance_record_integrity.schema.json",
  "schema_version": "1.0"
}
